{
  "schema_version": "0.1",
  "analysis_id": "sky-vanguard-shop-final-001",
  "input_kind": "layout_reference_screenshot",
  "source": {
    "source_ref": "attachment:sky-vanguard-shop-a2-case",
    "file_name": "sky-vanguard-shop.png",
    "width": 1920,
    "height": 1080,
    "orientation": "landscape",
    "capture_limitations": ["截图右缘轻微裁切"]
  },
  "user_focus": "主要参考分类、商品列表、详情和主要操作的布局关系。",
  "page": {
    "page_type": "shop",
    "page_purpose": "浏览装备商品并查看当前选择。",
    "page_state": "一个商品卡呈选中状态。",
    "presentation_mode": "fullscreen",
    "confidence": 0.93
  },
  "regions": [
    {
      "region_id": "page_background",
      "region_type": "background_region",
      "label": "页面背景区",
      "description": "覆盖整页的低对比环境背景。",
      "parent_region_id": null,
      "approximate_bounds": {"x": 0.0, "y": 0.0, "width": 1.0, "height": 1.0},
      "z_order": 0,
      "evidence_level": "observed",
      "confidence": 0.98
    },
    {
      "region_id": "top_status",
      "region_type": "global_status_region",
      "label": "顶部资源状态区",
      "description": "横跨页面顶部，展示三组图标与数值摘要。",
      "parent_region_id": null,
      "approximate_bounds": {"x": 0.0, "y": 0.0, "width": 1.0, "height": 0.1},
      "z_order": 2,
      "evidence_level": "observed",
      "confidence": 0.97
    },
    {
      "region_id": "category_navigation",
      "region_type": "navigation_region",
      "label": "左侧分类区",
      "description": "左侧纵向排列五个分类标签。",
      "parent_region_id": null,
      "approximate_bounds": {"x": 0.02, "y": 0.13, "width": 0.16, "height": 0.75},
      "z_order": 2,
      "evidence_level": "observed",
      "confidence": 0.95
    },
    {
      "region_id": "product_list",
      "region_type": "object_list_region",
      "label": "中央商品列表区",
      "description": "中央区域以两行网格展示六张可见商品卡。",
      "parent_region_id": null,
      "approximate_bounds": {"x": 0.2, "y": 0.13, "width": 0.46, "height": 0.75},
      "z_order": 2,
      "evidence_level": "observed",
      "confidence": 0.96
    },
    {
      "region_id": "product_detail",
      "region_type": "detail_region",
      "label": "右侧商品详情区",
      "description": "展示当前商品的较大预览、属性和操作。",
      "parent_region_id": null,
      "approximate_bounds": {"x": 0.68, "y": 0.13, "width": 0.3, "height": 0.82},
      "z_order": 2,
      "evidence_level": "observed",
      "confidence": 0.94
    },
    {
      "region_id": "purchase_action",
      "region_type": "primary_action_region",
      "label": "购买操作区",
      "description": "详情区底部的高对比宽按钮式区域。",
      "parent_region_id": "product_detail",
      "approximate_bounds": {"x": 0.72, "y": 0.78, "width": 0.22, "height": 0.11},
      "z_order": 3,
      "evidence_level": "inferred",
      "confidence": 0.82
    }
  ],
  "region_relationships": [
    {
      "relationship_id": "rel_categories_control_list",
      "source_region_id": "category_navigation",
      "target_region_id": "product_list",
      "relationship_type": "controls",
      "description": "高亮分类与商品网格并置，推断左侧分类控制中央列表。",
      "evidence_level": "inferred",
      "confidence": 0.78
    },
    {
      "relationship_id": "rel_list_adjacent_detail",
      "source_region_id": "product_list",
      "target_region_id": "product_detail",
      "relationship_type": "adjacent-to",
      "description": "商品列表位于详情区左侧。",
      "evidence_level": "observed",
      "confidence": 0.96
    },
    {
      "relationship_id": "rel_detail_contains_action",
      "source_region_id": "product_detail",
      "target_region_id": "purchase_action",
      "relationship_type": "parent-child",
      "description": "操作区位于详情区内部。",
      "evidence_level": "observed",
      "confidence": 0.95
    }
  ],
  "component_groups": [
    {
      "group_id": "resource_summary",
      "group_type": "resource_group",
      "label": "资源摘要组",
      "region_id": "top_status",
      "description": "三组图标与数值沿顶部横向排列。",
      "visible_item_count": 3,
      "repeat_pattern": {"is_repeated": true, "direction": "row", "count_certainty": "exact", "notes": null},
      "evidence_level": "observed",
      "confidence": 0.96
    },
    {
      "group_id": "category_tabs",
      "group_type": "tab_group",
      "label": "分类标签组",
      "region_id": "category_navigation",
      "description": "五个纵向标签共享尺寸和选中样式。",
      "visible_item_count": 5,
      "repeat_pattern": {"is_repeated": true, "direction": "column", "count_certainty": "exact", "notes": null},
      "evidence_level": "observed",
      "confidence": 0.95
    },
    {
      "group_id": "product_cards",
      "group_type": "card_list",
      "label": "商品卡片组",
      "region_id": "product_list",
      "description": "六张可见商品卡按两行网格排列。",
      "visible_item_count": 6,
      "repeat_pattern": {"is_repeated": true, "direction": "grid", "count_certainty": "exact", "notes": "只记录当前可靠可见的六张卡，不推断裁切区域总量。"},
      "evidence_level": "observed",
      "confidence": 0.97
    },
    {
      "group_id": "product_information",
      "group_type": "detail_panel",
      "label": "商品信息组",
      "region_id": "product_detail",
      "description": "较大商品预览、名称位置和属性摘要组成详情。",
      "visible_item_count": null,
      "repeat_pattern": {"is_repeated": false, "direction": "none", "count_certainty": "not_applicable", "notes": null},
      "evidence_level": "observed",
      "confidence": 0.9
    },
    {
      "group_id": "purchase_controls",
      "group_type": "action_group",
      "label": "购买操作组",
      "region_id": "purchase_action",
      "description": "价格摘要和高对比按钮共同构成可能的购买操作。",
      "visible_item_count": 1,
      "repeat_pattern": {"is_repeated": false, "direction": "none", "count_certainty": "not_applicable", "notes": null},
      "evidence_level": "inferred",
      "confidence": 0.82
    }
  ],
  "visual_hierarchy": {
    "primary_focal_point": {"entity_id": "product_cards", "description": "中央商品网格形成主要浏览焦点。", "evidence_level": "observed", "confidence": 0.92},
    "secondary_focal_points": [
      {"entity_id": "product_information", "description": "右侧较大预览形成次级焦点。", "evidence_level": "observed", "confidence": 0.9}
    ],
    "primary_action": {"entity_id": "purchase_controls", "description": "高亮操作组很可能承担主要购买动作。", "evidence_level": "inferred", "confidence": 0.82},
    "supporting_information": [
      {"entity_id": "resource_summary", "description": "顶部资源摘要提供购买上下文。", "evidence_level": "inferred", "confidence": 0.76}
    ],
    "background_content": [
      {"entity_id": "page_background", "description": "低对比背景衬托前景内容。", "evidence_level": "observed", "confidence": 0.97}
    ]
  },
  "layout_rules": [
    {
      "rule_id": "rule_progressive_browse_to_detail",
      "description": "按从左到右的分类、列表、详情顺序组织浏览。",
      "source_evidence": ["category_navigation", "product_list", "product_detail"],
      "reuse_value": "适合先缩小范围、再比较对象和查看详情的原创页面。",
      "confidence": 0.9
    },
    {
      "rule_id": "rule_action_with_currency_icon",
      "description": "把资源摘要放在稳定顶部，把主要操作固定在详情区底部。",
      "source_evidence": ["top_status", "product_detail", "purchase_controls"],
      "reuse_value": "通过空间分离区分全局资源信息和当前对象操作，不继承具体图标造型。",
      "confidence": 0.87
    }
  ],
  "excluded_content": [
    {"category": "game_name", "description": "虚构页面标题 Sky Vanguard。", "reason": "具体名称不属于布局规律。"},
    {"category": "original_copy", "description": "商品和按钮文案。", "reason": "原始文案不属于布局参考。"},
    {"category": "currency_design", "description": "顶部与操作区中的金色翼形货币图标。", "reason": "只参考资源信息的位置和分组，不继承具体造型。"}
  ],
  "uncertainties": [
    {
      "uncertainty_id": "uncertain_list_total",
      "description": "无法确认列表完整总量。",
      "affected_entities": ["product_list", "product_cards"],
      "reason": "截图右缘轻微裁切。",
      "recommended_handling": "只使用可靠可见的六张卡，不推断总量。"
    }
  ],
  "overall_confidence": 0.91,
  "notes": ["该 final 已应用 A2 review 中的五项修正，并保持 A1 正式字段。"]
}
